<?xml version="1.0" encoding="UTF-8"?>
<tns:person age="26" birth="1982. 07. 02" name="임은천"
	xmlns:tns="http://www.example.org/HelloXSD"
	xmlns:xsi="http://www.w3.org/2001/XMLSchema-instance"
	xsi:schemaLocation="http://www.example.org/HelloXSD HelloXSD.xsd">
	<name>Magneto</name>
	<address>
		<nation>
			<item label="한국" code="1"></item>
			<item label="천국" code="2" />
		</nation>
		<state>
			<item label="전라남도" code="1" />
		</state>
		<city>
			<item label="순천시" code="1" />
		</city>
		<street>
			<item label="매곡동" code="1" />
		</street>
	</address>
</tns:person>